{
  "corpus_link": "https://cefael.efa.gr/detail.php?site_id=1&amp;actionID=page&amp;serie_id=EtCret&amp;volume_number=21&amp;issue_number=1&amp;ce=540ecor2uudeumpibfksblm7ss9s2lsi&amp;sp=276",
  "dimensions": "5 cm × 4.7 cm × 0.9 cm",
  "fetched_at": "2026-05-04T00:00:00Z",
  "genre_hint": "accountancy",
  "id": "HT 146",
  "kind_raw": "Tablet",
  "n_signs": 7,
  "n_words": 3,
  "period": "LM IB",
  "raw_transliteration": "AB78 / AB53-A305 / LOG:AB80 / AB53-AB77-AB59",
  "site": "Haghia Triada",
  "source": "sigla:document/HT%20146/",
  "source_url": "https://sigla.phis.me/document/HT%20146/",
  "support": "tablet",
  "tokens": [
    "AB78",
    "DIV",
    "AB53",
    "A305",
    "DIV",
    "LOG:AB80",
    "DIV",
    "AB53",
    "AB77",
    "AB59"
  ],
  "transcription_confidence": "clean"
}
