{
  "corpus_link": "https://cefael.efa.gr/detail.php?site_id=1&amp;actionID=page&amp;serie_id=EtCret&amp;volume_number=21&amp;issue_number=3&amp;ce=cooqm3a5q3s12vmvdqppfim4sk80ag09&amp;sp=130",
  "dimensions": "1.2 cm × 2.4 cm × 1.9 cm",
  "fetched_at": "2026-05-04T00:00:00Z",
  "genre_hint": "accountancy",
  "id": "KH Wa 1008",
  "kind_raw": "Nodule",
  "n_signs": 1,
  "n_words": 0,
  "period": "LM IB",
  "raw_transliteration": "LOG:AB74",
  "site": "Khania",
  "source": "sigla:document/KH%20Wa%201008/",
  "source_url": "https://sigla.phis.me/document/KH%20Wa%201008/",
  "support": "nodule",
  "tokens": [
    "LOG:AB74"
  ],
  "transcription_confidence": "clean"
}
