{
  "corpus_link": "https://cefael.efa.gr/detail.php?site_id=1&amp;actionID=page&amp;serie_id=EtCret&amp;volume_number=21&amp;issue_number=2&amp;ce=cooqm3a5q3s12vmvdqppfim4sk80ag09&amp;sp=154",
  "dimensions": "3 cm × 3 cm × 0.9 cm",
  "fetched_at": "2026-05-04T00:00:00Z",
  "genre_hint": "accountancy",
  "id": "PH Wc 39a",
  "kind_raw": "Roundel",
  "n_signs": 2,
  "n_words": 1,
  "period": "MM II",
  "raw_transliteration": "AB57-AB07",
  "site": "Phaistos",
  "source": "sigla:document/PH%20Wc%2039a/",
  "source_url": "https://sigla.phis.me/document/PH%20Wc%2039a/",
  "support": "roundel",
  "tokens": [
    "AB57",
    "AB07"
  ],
  "transcription_confidence": "clean"
}
