{
  "corpus_link": "https://cefael.efa.gr/detail.php?site_id=1&amp;actionID=page&amp;serie_id=EtCret&amp;volume_number=21&amp;issue_number=2&amp;ce=ri69sv28ch462rl94m9pcr3glih11l21&amp;sp=137",
  "dimensions": "2.6 cm × 2.5 cm × 0.9 cm",
  "fetched_at": "2026-05-04T00:00:00Z",
  "genre_hint": "accountancy",
  "id": "HT Wc 3016a",
  "kind_raw": "Tablet",
  "n_signs": 3,
  "n_words": 1,
  "period": "LM IB",
  "raw_transliteration": "AB77-AB81-AB03",
  "site": "Haghia Triada",
  "source": "sigla:document/HT%20Wc%203016a/",
  "source_url": "https://sigla.phis.me/document/HT%20Wc%203016a/",
  "support": "tablet",
  "tokens": [
    "AB77",
    "AB81",
    "AB03"
  ],
  "transcription_confidence": "clean"
}
