{
  "corpus_link": "https://cefael.efa.gr/detail.php?site_id=1&amp;actionID=page&amp;serie_id=EtCret&amp;volume_number=21&amp;issue_number=1&amp;ce=540ecor2uudeumpibfksblm7ss9s2lsi&amp;sp=336",
  "dimensions": "5.2 cm × 2.2 cm × 0.8 cm",
  "fetched_at": "2026-05-04T00:00:00Z",
  "genre_hint": "accountancy",
  "id": "PH 12a",
  "kind_raw": "Tablet",
  "n_signs": 4,
  "n_words": 1,
  "period": "MM IIB",
  "raw_transliteration": "[?]-AB180-A339-AB100",
  "site": "Phaistos",
  "source": "sigla:document/PH%2012a/",
  "source_url": "https://sigla.phis.me/document/PH%2012a/",
  "support": "tablet",
  "tokens": [
    "[?]",
    "AB180",
    "A339",
    "AB100"
  ],
  "transcription_confidence": "clean"
}
