{
  "corpus_link": "https://cefael.efa.gr/detail.php?site_id=1&amp;actionID=page&amp;serie_id=EtCret&amp;volume_number=21&amp;issue_number=1&amp;ce=540ecor2uudeumpibfksblm7ss9s2lsi&amp;sp=104",
  "dimensions": "4.6 cm × 6.1 cm × 0.9 cm",
  "fetched_at": "2026-05-04T00:00:00Z",
  "genre_hint": "accountancy",
  "id": "HT 36",
  "kind_raw": "Tablet",
  "n_signs": 13,
  "n_words": 2,
  "period": "LM IB",
  "raw_transliteration": "AB46-AB07 / LOG:A638 / LOG:A578 / [?] / [?] / [?] / FRAC:A707 / AB51-AB79-AB54 / FRAC:A707 / [?]",
  "site": "Haghia Triada",
  "source": "sigla:document/HT%2036/",
  "source_url": "https://sigla.phis.me/document/HT%2036/",
  "support": "tablet",
  "tokens": [
    "AB46",
    "AB07",
    "DIV",
    "LOG:A638",
    "DIV",
    "LOG:A578",
    "DIV",
    "[?]",
    "DIV",
    "[?]",
    "DIV",
    "[?]",
    "DIV",
    "FRAC:A707",
    "DIV",
    "AB51",
    "AB79",
    "AB54",
    "DIV",
    "FRAC:A707",
    "DIV",
    "[?]"
  ],
  "transcription_confidence": "fragmentary"
}
