{
  "corpus_link": "https://cefael.efa.gr/detail.php?site_id=1&amp;actionID=page&amp;serie_id=EtCret&amp;volume_number=21&amp;issue_number=3&amp;ce=540ecor2uudeumpibfksblm7ss9s2lsi&amp;sp=92",
  "dimensions": "2.8 cm × 3.5 cm × 0.9 cm",
  "fetched_at": "2026-05-04T00:00:00Z",
  "genre_hint": "accountancy",
  "id": "KH 41",
  "kind_raw": "Tablet",
  "n_signs": 3,
  "n_words": 1,
  "period": "LM IB",
  "raw_transliteration": "AB77-AB59-AB27",
  "site": "Khania",
  "source": "sigla:document/KH%2041/",
  "source_url": "https://sigla.phis.me/document/KH%2041/",
  "support": "tablet",
  "tokens": [
    "AB77",
    "AB59",
    "AB27"
  ],
  "transcription_confidence": "clean"
}
