{
  "corpus_link": "https://cefael.efa.gr/detail.php?site_id=1&amp;actionID=page&amp;serie_id=EtCret&amp;volume_number=21&amp;issue_number=1&amp;ce=540ecor2uudeumpibfksblm7ss9s2lsi&amp;sp=304",
  "dimensions": "8.9 cm × 2 cm × 1.8 cm",
  "fetched_at": "2026-05-04T00:00:00Z",
  "genre_hint": "accountancy",
  "id": "MA 1a",
  "kind_raw": "Tablet",
  "n_signs": 8,
  "n_words": 2,
  "period": "MM IIIB",
  "raw_transliteration": "AB28-AB51-AB40 / LOG:AB47 / AB78-AB45-AB73-AB55",
  "site": "Mallia",
  "source": "sigla:document/MA%201a/",
  "source_url": "https://sigla.phis.me/document/MA%201a/",
  "support": "tablet",
  "tokens": [
    "AB28",
    "AB51",
    "AB40",
    "DIV",
    "LOG:AB47",
    "DIV",
    "AB78",
    "AB45",
    "AB73",
    "AB55"
  ],
  "transcription_confidence": "clean"
}
