{
  "corpus_link": "https://cefael.efa.gr/detail.php?site_id=1&amp;actionID=page&amp;serie_id=EtCret&amp;volume_number=21&amp;issue_number=1&amp;ce=540ecor2uudeumpibfksblm7ss9s2lsi&amp;sp=210",
  "dimensions": "5.3 cm × 4.5 cm × 0.8 cm",
  "fetched_at": "2026-05-04T00:00:00Z",
  "genre_hint": "accountancy",
  "id": "HT 107",
  "kind_raw": "Tablet",
  "n_signs": 4,
  "n_words": 0,
  "period": "LM IB",
  "raw_transliteration": "[?] / [?] / LOG:AB04 / LOG:A332",
  "site": "Haghia Triada",
  "source": "sigla:document/HT%20107/",
  "source_url": "https://sigla.phis.me/document/HT%20107/",
  "support": "tablet",
  "tokens": [
    "[?]",
    "DIV",
    "[?]",
    "DIV",
    "LOG:AB04",
    "DIV",
    "LOG:A332"
  ],
  "transcription_confidence": "fragmentary"
}
