{
  "corpus_link": "https://cefael.efa.gr/detail.php?site_id=1&amp;actionID=page&amp;serie_id=EtCret&amp;volume_number=21&amp;issue_number=3&amp;ce=540ecor2uudeumpibfksblm7ss9s2lsi&amp;sp=192",
  "dimensions": "5.1 cm × 8.6 cm × 1.2 cm",
  "fetched_at": "2026-05-04T00:00:00Z",
  "genre_hint": "accountancy",
  "id": "ZA 10a",
  "kind_raw": "Tablet",
  "n_signs": 29,
  "n_words": 7,
  "period": "LM IB",
  "raw_transliteration": "AB59-AB06-AB04 / LOG:AB03 / AB08-AB81-AB73-AB06 / AB08-AB59-AB06-AB04 / AB08-AB73-AB01-AB10 / AB08-AB51-AB81-AB73-AB06 / AB01-AB28-AB39-AB59 / AB51-AB27-AB17-AB09",
  "site": "Zakros",
  "source": "sigla:document/ZA%2010a/",
  "source_url": "https://sigla.phis.me/document/ZA%2010a/",
  "support": "tablet",
  "tokens": [
    "AB59",
    "AB06",
    "AB04",
    "DIV",
    "LOG:AB03",
    "DIV",
    "AB08",
    "AB81",
    "AB73",
    "AB06",
    "DIV",
    "AB08",
    "AB59",
    "AB06",
    "AB04",
    "DIV",
    "AB08",
    "AB73",
    "AB01",
    "AB10",
    "DIV",
    "AB08",
    "AB51",
    "AB81",
    "AB73",
    "AB06",
    "DIV",
    "AB01",
    "AB28",
    "AB39",
    "AB59",
    "DIV",
    "AB51",
    "AB27",
    "AB17",
    "AB09"
  ],
  "transcription_confidence": "clean"
}
