{
  "corpus_link": "https://cefael.efa.gr/detail.php?site_id=1&amp;actionID=page&amp;serie_id=EtCret&amp;volume_number=21&amp;issue_number=1&amp;ce=540ecor2uudeumpibfksblm7ss9s2lsi&amp;sp=52",
  "dimensions": "5.3 cm × 7.4 cm × 1 cm",
  "fetched_at": "2026-05-04T00:00:00Z",
  "genre_hint": "accountancy",
  "id": "HT 8a",
  "kind_raw": "Tablet",
  "n_signs": 27,
  "n_words": 6,
  "period": "LM IB",
  "raw_transliteration": "AB46-AB07 / LOG:A618 / AB56-AB77-AB60-AB37 / FRAC:A707 / LOG:AB03 / FRAC:A707 / AB04-A301 / AB16-A310-AB28 / FRAC:A707 / FRAC:A704 / AB41-AB67-AB60 / FRAC:A704 / AB67-AB27-[?]-AB59-AB06 / FRAC:A707",
  "site": "Haghia Triada",
  "source": "sigla:document/HT%208a/",
  "source_url": "https://sigla.phis.me/document/HT%208a/",
  "support": "tablet",
  "tokens": [
    "AB46",
    "AB07",
    "DIV",
    "LOG:A618",
    "DIV",
    "AB56",
    "AB77",
    "AB60",
    "AB37",
    "DIV",
    "FRAC:A707",
    "DIV",
    "LOG:AB03",
    "DIV",
    "FRAC:A707",
    "DIV",
    "AB04",
    "A301",
    "DIV",
    "AB16",
    "A310",
    "AB28",
    "DIV",
    "FRAC:A707",
    "DIV",
    "FRAC:A704",
    "DIV",
    "AB41",
    "AB67",
    "AB60",
    "DIV",
    "FRAC:A704",
    "DIV",
    "AB67",
    "AB27",
    "[?]",
    "AB59",
    "AB06",
    "DIV",
    "FRAC:A707"
  ],
  "transcription_confidence": "partial"
}
