{
  "corpus_link": "https://cefael.efa.gr/detail.php?site_id=1&amp;actionID=page&amp;serie_id=EtCret&amp;volume_number=21&amp;issue_number=1&amp;ce=540ecor2uudeumpibfksblm7ss9s2lsi&amp;sp=158",
  "dimensions": "2.5 cm × 2.2 cm × 0.9 cm",
  "fetched_at": "2026-05-04T00:00:00Z",
  "genre_hint": "accountancy",
  "id": "HT 68",
  "kind_raw": "Tablet",
  "n_signs": 2,
  "n_words": 1,
  "period": "LM IB",
  "raw_transliteration": "AB65 / LOG:AB100",
  "site": "Haghia Triada",
  "source": "sigla:document/HT%2068/",
  "source_url": "https://sigla.phis.me/document/HT%2068/",
  "support": "tablet",
  "tokens": [
    "AB65",
    "DIV",
    "LOG:AB100"
  ],
  "transcription_confidence": "clean"
}
