{
  "corpus_link": "https://cefael.efa.gr/detail.php?site_id=1&amp;actionID=page&amp;serie_id=EtCret&amp;volume_number=21&amp;issue_number=2&amp;ce=ri69sv28ch462rl94m9pcr3glih11l21&amp;sp=132",
  "dimensions": "1.9 cm × 1.8 cm × 1.1 cm",
  "fetched_at": "2026-05-04T00:00:00Z",
  "genre_hint": "accountancy",
  "id": "HT Wc 3002",
  "kind_raw": "Roundel",
  "n_signs": 3,
  "n_words": 1,
  "period": "LM IB",
  "raw_transliteration": "AB03-AB09-AB57",
  "site": "Haghia Triada",
  "source": "sigla:document/HT%20Wc%203002/",
  "source_url": "https://sigla.phis.me/document/HT%20Wc%203002/",
  "support": "roundel",
  "tokens": [
    "AB03",
    "AB09",
    "AB57"
  ],
  "transcription_confidence": "clean"
}
