{
  "corpus_link": "https://cefael.efa.gr/detail.php?site_id=1&amp;actionID=page&amp;serie_id=EtCret&amp;volume_number=21&amp;issue_number=3&amp;ce=540ecor2uudeumpibfksblm7ss9s2lsi&amp;sp=172",
  "dimensions": "7.3 cm × 12.3 cm × 1.4 cm",
  "fetched_at": "2026-05-04T00:00:00Z",
  "genre_hint": "accountancy",
  "id": "ZA 4a",
  "kind_raw": "Tablet",
  "n_signs": 30,
  "n_words": 10,
  "period": "LM IB",
  "raw_transliteration": "LOG:AB38 / AB39-[?]-AB09 / AB57-AB05-AB57 / AB08-AB37-AB26 / AB57-AB03 / AB69-AB13-AB09 / AB78-AB41-AB79-AB38 / AB28b-AB55-AB80-AB27 / AB41-AB39-AB67 / AB38-AB82 / AB77-AB07",
  "site": "Zakros",
  "source": "sigla:document/ZA%204a/",
  "source_url": "https://sigla.phis.me/document/ZA%204a/",
  "support": "tablet",
  "tokens": [
    "LOG:AB38",
    "DIV",
    "AB39",
    "[?]",
    "AB09",
    "DIV",
    "AB57",
    "AB05",
    "AB57",
    "DIV",
    "AB08",
    "AB37",
    "AB26",
    "DIV",
    "AB57",
    "AB03",
    "DIV",
    "AB69",
    "AB13",
    "AB09",
    "DIV",
    "AB78",
    "AB41",
    "AB79",
    "AB38",
    "DIV",
    "AB28b",
    "AB55",
    "AB80",
    "AB27",
    "DIV",
    "AB41",
    "AB39",
    "AB67",
    "DIV",
    "AB38",
    "AB82",
    "DIV",
    "AB77",
    "AB07"
  ],
  "transcription_confidence": "partial"
}
